Class,unique_id,text
Real,1283021185274478592,"around 570,000 people worldwide have lost their lives to coronavirus with more than 13 million confirmed cases

these maps and charts track the global spread of the virus

"
Real,1283010892536455172,"in africa, coronavirus cases are increasing and deaths are rising, according to the who

how fast is it spreading across the continent?

"
Real,1282956270631292928,california reimposes restrictions after it saw a 20% rise in positive coronavirus tests in the past two weeks 
Real,1282948168150388736,"florida is becoming the new us coronavirus epicentre, but how did the state get so badly hit by the virus? "
Real,1282944527364431873,"➡️ france awards health workers pay rises worth €8bn (£7.2bn; $9bn)
➡️ number of global infections since outbreak began passes 13m
➡️ in england, face masks will be compulsory in shops from 24 july

latest on the pandemic: "
Real,1282831200785256451,coronavirus: california reimposes sweeping restrictions amid virus spike 
Real,1282818075725893632,coronavirus india: rush for plasma therapy as covid-19 cases rise 
Real,1282814106630868996,coronavirus: how did florida get so badly hit by covid-19 
Real,1282812989863858178,coronavirus: why attitudes to masks have changed around the world 
Real,1282760803440091136,"india's rubbish collectors fear coronavirus medical waste is putting their lives at risk

"
Real,1282748962961862656,"nations heading in wrong direction with covid-19, says who "
Real,1282620168724713472,"""tax us. tax us. tax us""

more than 80 millionaires from around the world call on governments to permanently increase taxes on the wealthiest in response to the pandemic

"
Real,1282608505833365509,iran has seen more and more #coronavirus deaths in recent weeks. we’ve looked at what’s been happening. 
Real,1282592219820625921,"south africa bans alcohol sales again to take pressure off healthcare system, as country battles coronavirus "
Real,1282583067102720000,"➡️ global record for daily coronavirus cases, who says
➡️ mexico now has the fourth-most virus deaths, passing italy
➡️ palestinian authority imposes curfew on the west bank

latest on the pandemic: "
Real,1282418721747861509,coronavirus: south africa bans alcohol sales again to combat covid-19 
Real,1282416551552049152,"coronavirus: florida sets new daily case record of 15,299 "
Real,1282344627786448903,"""it almost feels like you're having a private tour""

the bbc's quentin sommerville says visiting the vatican museum in the age of coronavirus is a quieter, different experience

"
Real,1282333781584683009,three generations of bollywood bachchan family infected with coronavirus 
Real,1282327039891185667,"as latin america battles devastating coronavirus outbreaks, reality check takes a deeper look at fake cures and unproven treatments. "
Real,1282323859098697729,"“it’s not just a song, i do it from my heart.”
 
after a long shift this nurse stays late to play her violin to coronavirus patients 💜 "
Real,1282300860316475392,"“i think it’s a great thing to wear a mask""

president trump wears a face mask in public for the first time since the start of the coronavirus pandemic

"
Real,1282279225601425408,"covid-19 survivor, 104, gets back to crosswords and crochet "
Real,1282275323757899778,"one of india's best known film actors, amitabh bachchan, says he has tested positive for covid-19

"
Real,1282114878505984000,coronavirus: thousands protest in israel over handling of economy 
Real,1282096153430032387,coronavirus: donald trump finally wears mask in public 
Real,1282092187593973766,coronavirus: the chaplains toiling on the frontlines 
Real,1282044841086652417,coronavirus: two more covid-19-related deaths in ireland 
Real,1282041217069588480,coronavirus: indian film star amitabh bachchan tests positive 
Real,1282030287032025088,walt disney world reopens in florida amid covid-19 surge 
Real,1281731936021602305,coronavirus: why politics means success or failure in south america 
Real,1281731935975374848,coronavirus: thrifty germany takes on debt to rescue arts 
Real,1281729668715094016,the struggle to keep india's covid-19 patients breathing 
Real,1281686692894781448,coronavirus: how bad was the crisis in us care homes? 
Real,1281683191108075520,ghislaine maxwell requests bail due to 'significant' coronavirus risk 
Real,1281657020492451840,"anthony fauci, the chief us immunologist, says scientists are ""aspirationally hopeful"" that a vaccine would be ready by 2021
 
but it's not clear how achievable this is
 
read more about what the us has done wrong – and right – in tackling the pandemic
 
"
Real,1281657012636581889,"while in several us states the situation has worsened, in new york - once the epicentre - there's been remarkable improvements
 
daily deaths have dropped to single digits
 
only 1.38% of the state's coronavirus tests last week returned positive results
 
"
Real,1281657010925309956,"""we have tested over 40 million people"" 
 
president trump tweeted on saturday: ""by so doing, we show cases, 99% of which are totally harmless""
 
this contradicts scientific research showing a fifth of covid-19 cases result in severe respiratory distress
 
"
Real,1281657008463269889,"latest numbers show many of the newly infected are younger americans, who have been some of the quickest to return to socialising
 
some politicians have essentially encouraged this, saying the young &amp; healthy have little to fear from covid-19

"
Real,1281657001295204353,"the surges are also leading to delays and shortages in testing - an area that had appeared to be a strength for the us
 
without adequate testing, it is difficult to identify and isolate new cases and locations where the virus is spreading unchecked

"
Real,1281656999034458113,"a month ago us coronavirus numbers appeared stable 
 
covid-19 spread had slowed, with some states easing restrictions
 
but numbers were misleading - states hit hard early had declining cases, while numbers in other states were increasing &amp; then surging

"
Real,1281656996874407936,"the us topped 60,000 recorded daily new coronavirus cases this week 
 
there was a big surge in the south and west of the country, with arizona registering as many new cases as the whole of the eu
 
did it have to be this way though?
 
[thread]

"
Real,1281608170239143936,"""we're going to distribute [food] to the village""

mexican cartels are accused of fuelling an opioid crisis that has destroyed thousands of lives

now they're trying to win over the hearts and minds of locals after the pandemic left many without work "
Real,1281555879599517697,"🇮🇳each indian state tells a different story

delhi, maharashtra, and tamil nadu make up about 60% of the country's caseload

but india should be ""broken down into districts"" for a successful strategy against coronavirus, dr jameel says

"
Real,1281555876562731010,"🇮🇳india's death rate is low

the official death toll from covid-19 is 8th highest globally, but deaths per million are low, compared to the rest of the world

the death rate is similar to countries in the region, but we don’t know why that's the case

"
Real,1281555863380070401,"six months after its first confirmed coronavirus infection india now has the third highest number of cases, worldwide

scientists say india hasn't done enough testing to have clear data 

they also don't understand its unusually low death rate

[thread]

"
Real,1281520960307372032,"formula 1 has added two more races to its 2020 calendar as it seeks to rebuild the season during the coronavirus crisis.

more: "
Real,1281423036680491008,singapore election held against backdrop of pandemic and recession 
Real,1281404587061186567,coronavirus: idlib's first covid-19 case raises fears for syria camps 
Real,1281388474155896833,coronavirus: cosmetic surgery clinics see rise in demand 
Real,1281375242812821507,coronavirus: the british-pakistani doctors saving lives in both countries 
Real,1281372984809271296,coronavirus: how new zealand went 'hard and early' to beat covid-19 
Real,1281344972789362695,"the us has become a global coronavirus hotspot, with more than 3 million people testing positive for covid-19 and over 131,000 deaths.

what’s behind the rise? thread 👇 (1/7)
 
"
Real,1281325570308087810,president trump's ex-lawyer michael cohen back in jail after being released in may due to coronavirus concerns 
Real,1281287389042872320,serbia scraps coronavirus curfew plan for belgrade after protests 
Real,1281279191116320768,"the show has been organised by hollywood entertainment agency img, under a loan agreement with egypt for the artefacts

img say it cost £19m to stage the london show, but 580,000+ people visited before covid-19 – that’s already £18 million in ticket sales

"
Real,1281222137404166147,"can you become reinfected with coronavirus once you've already had it? 

here's what we know so far

"
Real,1281194299401678848,"man admits selling fake coronavirus cure kits to france &amp; us

"
Real,1281177555383582720,"six months after its first confirmed infection, india has overtaken russia to record the world's third largest number of coronavirus cases

here are five things you need to know about its outbreak "
Real,1281172595753259008,"➡️oxfam warns 12,000 people a day could die from hunger linked to covid-19
➡️australia's second-largest city, melbourne, begins second lockdown
➡️uk public spending to tackle covid-19 rises to nearly £190bn ($240bn)

latest coronavirus updates: "
Real,1281024407239110657,coronavirus: is india the next global hotspot? 
Real,1280982752133877764,"from states opening too quickly, to science advancing

here's the things the us has got right and wrong throughout the covid-19 pandemic ⬇️
"
Real,1280976889117638656,canada projects $343bn deficit amid covid 'uncertainty' 
Real,1280963130688974849,us surpasses three million coronavirus cases 
Real,1280910025024843776,texas set to resume prisoner executions amid pandemic 
Real,1280903832667553795,"people in serbia have gathered in protest against stricter lockdown measures due to come into force this weekend as coronavirus cases rise in the country

"
Real,1280883020669616128,"melbourne begins second lockdown in response to spike in new coronavirus infections 

"
Real,1280877067010289665,"the 2020 #rydercup has been postponed until 2021 because of the coronavirus pandemic.

the presidents cup has also been moved to 2022.

full story 👉 "
Real,1280860809351102464,"“we think we screwed up... we didn’t social distance enough”

kieran lives in melbourne in australia which has gone back into lockdown after coronavirus cases spiked again "
Real,1280858937860988931,"dr anthony fauci, adviser to the white house on #coronavirus, says the us is ""knee-deep"" in the first wave 👇

📱 more @bbcworld: "
Real,1280830279427514370,coronavirus: how the pandemic is changing fraternities and sororities 
Real,1280820157510795264,"ministers who've had recent contact with brazil's president, jair bolsonaro, are getting tested for coronavirus 

"
Real,1280803052837093381,"""the glove or mask that you take off and casually disregard... could easily be the glove or mask that kills a whale""

as the world battles coronavirus, more and more protective equipment is ending up in the sea

"
Real,1280795305483603970,"the anonymous letters providing solace during the coronavirus pandemic 

"
Real,1280774165289734146,"👨‍⚕️👩‍⚕️ you may not be sitting where you used to

software can create floor plans to calculate safe bubbles around each worker, working out different ways to place staff so their bubbles do not overlap, keeping people apart to stop the spread of the virus

"
Real,1280774150823477248,"many of us have been working from home since march

our relationship with the office has changed, perhaps forever

🏢 if and when we go back to the office what will it look like?
💻 how will technology and coronavirus change the way offices work?

[thread]
"
Real,1280760349927575553,"dr david nabarro, the world health organisation's envoy for covid, says president trump's decision to leave will have a budgetary impact as the who is ""underfunded"" and america pulling out is ""not what the world's people need"" r4today
"
Real,1280712992393433089,coronavirus: spain's holiday islands shake off party image 
Real,1280673150892638208,coronavirus: the tenants enduring australia's toughest lockdown 
Real,1280641962375249925,"coronavirus: airborne transmission cannot be ruled out, who says "
Real,1280621492989046784,"brazil's president jair bolsonaro, who repeatedly played down the risks of covid-19, has tested positive

he took the test, his fourth, on monday after developing symptoms, including a high temperature

"
Real,1280585435337699328,"read more about the origins of the virus, and its fallout in wuhan, here: "
Real,1280584155294765057,"china has agreed to an independent investigation into the international response to the virus, but it’s unclear what the remit will be, who will take part, and when it might happen 

president xi says it will have to wait until the pandemic is over

"
Real,1280584152040050688,"many scientists are now trying to understand how to better contain a similar outbreak 

there’s disagreement as to whether the risks of studying and manipulating viruses in labs outweigh the benefits

"
Real,1280584146620952577,"the lab leak theory became more well known after us president donald trump said he had seen evidence that the wiv was the origin of the virus

but the theory has been largely dismissed by scientists

"
Real,1280584143206789120,"another theory, that the virus came from the wuhan institute of virology (wiv), has also gained some traction 

but none of the lab leak theories – animal virus, man-made virus, deliberate or accidental – have been backed up with any concrete proof

"
Real,1280584134310670336,"this theory has been dismissed by china

according to their tests, traces of the virus were found there, but none were detected on any animal samples

they say the outbreak likely began elsewhere, and the crowded market helped to spread it

"
Real,1280584131362074624,"the sars coronavirus, which caused 774 deaths, is thought to have jumped from bats to humans via the civet cat

nearly two decades on, there was initial speculation that the new coronavirus, sars-cov-2, came from an intermediary host animal at the market

"
Real,1280584128463847424,"the huanan seafood market was originally believed to be where the virus emerged

a large number of coronaviruses are carried by bats

sometimes they jump directly from bats to humans, or they jump from bats to an intermediary animal, and then on to humans

"
Real,1280584125108420608,"on 1 december 2019, a man in his 70s fell ill in wuhan - he was later diagnosed as the first patient with covid-19

but it wasn’t until 23 january 2020 that wuhan went into lockdown

"
Real,1280584119634845696,"the chinese city of wuhan, where coronavirus first emerged, is still feeling the effects of the coronavirus outbreak

called sars-cov-2, the virus which causes covid-19 is still providing more questions than answers in the central-chinese city

[thread]

"
Real,1280565571889893377,kenya schools to remain closed until 2021 due to coronavirus pandemic 
Real,1280528311484104704,"""if you can't wear a mask and wash your hands and social distance, i've got no respect for you""

hollywood actor tom hanks speaks out on his thoughts about preventing the spread of coronavirus

"
Real,1280525524255813637,"@bbcbreaking president bolsonaro has repeatedly played down risks posed by coronavirus, calling it ""a little flu"" and saying he would not be seriously affected by it "
Real,1280523652040179712,"brazil's president jair bolsonaro tests positive for coronavirus

"
Real,1280461541444386817,"❌ borders with new south wales and south australia to close
🏠 five million residents told to stay at home unless for essential reasons
📚 schools will largely return to distance learning

melbourne returns to lockdown as coronavirus cases surge "
Real,1280436847764819968,"lockdown lifted in german city of gütersloh, after court ruling

the lockdown was imposed to tackle coronavirus outbreak at meat packing facility "
Real,1280418391967313920,"in recent years there have been outbreaks in the democratic republic of congo and madagascar

""bubonic plague is caused by a bacterium,” says university of southampton's dr matthew dryden: “unlike covid-19, [it's] readily treated with antibiotics""

"
Real,1280376114997796865,india coronavirus: life-saving covid-19 drugs sold in delhi black market 
Real,1280294900140032000,coronavirus: spanish study casts doubt on herd immunity 
Real,1280281843464581122,coronavirus: how fast is it spreading in africa? 
Real,1280275601711140864,coronavirus: disease detectives track an invisible culprit 
Real,1280254650101497864,find out more about the search for coronavirus treatments: 
Real,1280254648461524994,"we don't know when we might have a drug to treat coronavirus, but results of trials should come in the next few months 

a vaccine will likely take longer as it will have to be developed from scratch, rather than repurposing drugs already deemed safe

"
Real,1280254645080854529,"antibodies are the body's way of attacking viruses

people who survive infection should have antibodies in their blood that can attack coronavirus

scientists are looking at ways to use survivors' blood 🩸 to help the most ill patients 

"
Real,1280254642820206593,"some drugs seem promising for treating the virus:

💊 dexamethasone - the steroid may cut the risk of death for patients on ventilators or on oxygen
💊 remdesivir - the antiviral can cut the duration of symptoms from 15 to 11 days 

"
Real,1280254639556919297,"there are 3 types of drug being tested:
💊 antivirals which directly attack coronavirus inside the body
💊 drugs which prevent the immune system over-reacting &amp; harming the body
💊 antibodies, from survivors' blood or made in a lab, that attack the virus

"
Real,1280254634574196741,"around the world scientists are working to find treatments for coronavirus

there are a number of studies underway, and some progress has been made 

so, how close are we to finding a treatment? 

[thread]

"
Real,1280180555984900098,ireland's coronavirus travel advice to remain until 20 july 
Real,1280166940208705541,"'why is my body not important?'

as the body positivity movement grows in popularity, active members of the community say they feel it excludes black women already maligned by mainstream beauty standards

filmed prior to the coronavirus pandemic

"
Real,1280098039680708611,"actor nick cordero, who spent months in intensive care after suffering complications from coronavirus, has died aged 41 "
Real,1280087780232749056,"professor xu zhangrun, who criticised china's handling of the coronavirus crisis, has been detained by authorities "
Real,1280072264164270080,the louvre museum reopens in paris after its closure nearly four months ago due to coronavirus 
Real,1280050819933634560,india scientists alarmed over 'unrealistic' covid vaccine deadline 
Real,1280043696197701637,"➡️ india becomes third-highest country for virus cases
➡️ new south wales in australia is closing border with neighbouring victoria 
➡️ scientists want who to take airborne risk more seriously

latest on the pandemic 👉 "
Real,1280037537424302080,coronavirus: australia to close victoria-new south wales border 
Real,1280020824595083264,coronavirus: india overtakes russia in covid-19 cases 
Real,1279955021094928384,coronavirus: australia to close victoria-new south wales border 
Real,1279933422186778625,coronavirus: how 'three musketeers' helped georgia fight virus 
Real,1279921503367200768,coronavirus in singapore: election campaigning without the handshakes 
Real,1279916952299986945,coronavirus: fda chief refuses to back trump's vaccine prediction 
Real,1279651754997669890,"coronavirus: mexico's death toll passes 30,000 "
Real,1279638753284325377,coronavirus funerals: sri lanka's muslims decry forced cremation 
Real,1279578656822693889,dominican republic votes in election postponed over virus 
Real,1279477763125248003,coronavirus clouds us independence day events 
Real,1279432228339154945,"other events are going ahead, but differently 

the capitol fourth concert in washington dc was pre-recorded this year and will be streamed 🎤

the iconic nathan's hot dog eating contest is set to go ahead, with coronavirus precautions in place 🌭

"
Real,1279432219338125314,"cities have cancelled parades, as coronavirus infections continue to rise

the national independence day parade in washington dc has been called off 

""covid-19 infection levels will not be abated to the degree that it would be safe,"" said organisers

"
Real,1279432217446539264,"usually, 4 july is a date for huge parades, fireworks displays and family gatherings in the us

but this year, independence day will look very different 🇺🇸

the pandemic has forced the cancellation of, or changes to, hundreds of events

[thread] 

"
Real,1279210338140000256,india coronavirus: questions over death of man 'turned away by 18 hospitals' 
Real,1279206927873069056,coronavirus: waiting for tourists on spain's costa del sol 
Real,1279205223022694400,coronavirus: what makes a gathering a ‘superspreader’ event? 
Real,1279201855160094721,coronavirus: japan's mysteriously low virus death rate 
Real,1279195029735714816,mount rushmore: trump to host 4 july event despite virus concerns 
Real,1279154924002185223,france's former pm edouard philippe faces inquiry into government's coronavirus response 
Real,1279063406495006724,coronavirus-denying cleric expelled by russian orthodox church after he seized control of a convent 
Real,1278994404431351808,"could covid-19 immunity passports, secured through a positive anti-body test, spark a new social divide? "
Real,1278954951847424000,"➡️ england's quarantine scrapped for arrivals from 'low risk' countries
➡️ texas orders face coverings to be worn in public
➡️ us sets new one-day record for coronavirus infections

latest on the pandemic: "
Real,1278891578594131968,coronavirus in north korea: kim jong-un claims 'shining success' 
Real,1278885286597005312,coronavirus: why has melbourne's outbreak worsened? 
Real,1278836919863042049,coronavirus in south africa: deciding who lives and dies in a cape town township 
Real,1278833540600381445,quiz of the week: which city had a coronavirus 'farewell' party? 
Real,1278813564560703490,"""my stomach churns when i see a shutter down... it's mind-blowing how quickly the world has changed""

thousands of indian restaurants in the uk could be lost due to the coronavirus pandemic. this is how some of them are coping

"
Real,1278802442449235970,"""we're currently having fish finger gate""
 
🦄 scarlett and her unicorn certainly sparked joy - but we knew her mum before she was famous! 
 
friend of the pod @clarewenham talks to us 24 hours into internet stardom on today's #coronavirusnewscast

"
Real,1278798725603786758,texas governor mandates wearing of face masks in counties with 20 or more coronavirus cases 
Real,1278742995748163584,"thread: where are #covid19 cases still rising? 
 
(1/7) the us broke a new daily record with 52,000 infections on wednesday. jimmy flores, who’s now recovering, thinks he got the virus after sharing drinks in a busy bar in arizona - one of the states that’s seen a spike in cases "
Real,1278695156527611910,"despite two straight months of jobs growth, us employment is still 15 million below its pre-pandemic level, with the jobless rate just above 11%

"
Real,1278694667945684993,"the us economy created jobs at a record pace in june, as firms took on more staff after the coronavirus downturn "
Real,1278672403556638720,"the top us expert in infectious diseases, dr anthony fauci, spoke to @justinonweb and expressed his concern over the rise in coronavirus cases in the country, warning of the risk of a greater outbreak if the latest surge is not controlled
#r4today podcast
"
Real,1278642011059425281,"ireland sees significant increase in percentage of coronavirus cases from international travel, health minister says "
Real,1278620298804428801,"primark plans to open five new stores in the us, france and poland, despite economic uncertainty over coronavirus 

"
Real,1278607066148622337,"➡️ us daily coronavirus infections hit new high
➡️ president trump changes tack and says he would wear a mask 
➡️ around 75 countries could be exempt from uk travel quarantine rules

latest on pandemic: "
Real,1278593274698219523,"coronavirus: 'i'm all for masks,' says trump in change of tone "
Real,1278591304671416320,"#americast is back! 🇺🇸@maitlis, @bbcjonsopel &amp; @awzurcher will be with you until polling day
 
on this episode...
 
- coronavirus cases on the rise
- president trump slips in the polls
- did russia place bounties on us troops?
 
listen on @bbcsounds "
Real,1278472444731445248,"coronavirus: 'i'm all for masks,' says trump in change of tone "
Real,1278470167530475520,how 'quacks' are guarding indian villages against covid-19 
Real,1278424545582514178,"""i can’t wait to see my country, however changed it might be"" 

student francesca de santis could never have anticipated how her year abroad in the us might turn out. now she is heading home to italy, one of the countries hardest hit by the virus

"
Real,1278421057565798401,"texas and florida have both seen a recent surge in coronavirus cases

how is affecting those that live there? "
Real,1278374564620361730,us buys up nearly all the next three months' production of coronavirus drug remdesivir 
