Class,unique_id,text
Real,1290958245008420864,"from @specialreports: as the coronavirus pandemic has grown, a chinese company that studies human genomes and collects data on these genetic blueprints built 58 labs in 18 countries "
Real,1290954716780929024,u.s. losses from coronavirus-related fraud and identity theft near $100 million as complaints of covid-19 scams double in most states 
Real,1290952960755867648,"australia reported a record 15 deaths from covid-19, all in victoria state, which was preparing to close much of its economy to control a second wave of infection that threatens to spread across the country "
Real,1290943238916972544,"uk shares rose as a clutch of quarterly earnings reports signalled a rebound in consumer demand following the easing of coronavirus restrictions, while insurer hastings surged after agreeing to a $2.2 billion buyout offer "
Real,1290943083329335297,europe’s experiment in using technology to fight coronavirus has achieved some early successes: millions of people have downloaded smartphone tracker apps and hundreds have uploaded the results of positive covid-19 tests 
Real,1290943043466559488,"bookmaker william hill reported a better-than-expected first-half profit, while announcing 119 uk betting shops closed by coronavirus lockdowns would not reopen as it combines its online and retail british businesses "
Real,1290933094074195968,honda sees 68% drop in annual profit as coronavirus slams car sales 
Real,1290932846463537152,"britain’s banks took a gloomier view than almost all their european peers in their second quarter earnings, as coronavirus fears, #brexit and low interest rates caused them to bake tougher 'worst-case' scenarios into their risk models "
Real,1290932163941208070,"gargling solution flies off japan's shelves, after the governor of the western prefecture of osaka suggests it could help fight coronavirus, triggering panicked buying reminiscent of the early days of mask shortages "
Real,1290931828036165632,"global coronavirus deaths exceed 700,000, one person dies every 15 seconds on average "
Real,1290929748596740097,"tv viewing surged during britain's covid-19 lockdown in april, with people spending twice as long watching streaming services like netflix, disney+ and amazon prime video, regulator ofcom said "
Real,1290926789590749184,"australia suffers record coronavirus deaths, triggering tighter curbs "
Real,1290926429069344768,india's police shamed by rare murder probe into custodial deaths of father and son locked up for violating a nationwide coronavirus lockdown 
Real,1290921080832630784,coronavirus complicates south korea flood response as hundreds gather in shelters 
Real,1290919227227070464,china's july exports seen falling on global virus surge; import growth cools: reuters poll 
Real,1290915488609050624,japan short of rescue plans for regional lenders hit by pandemic 
Real,1290912943085948929,gargling solution flies off japan's shelves after governor touts anti-virus effect 
Real,1290909176978440192,u.s. losses from coronavirus-related fraud and identity theft near $100 million as covid scams double 
Real,1290909161618890752,latin america now has world's highest coronavirus death toll 
Real,1290907931005849600,supermarket giant ahold reports 78% surge in second quarter earnings amid coronavirus 
Real,1290904192664707072,oil prices snap four-day winning streak as covid-19 cases grow 
Real,1290902877611925509,are they any use? with europe's black-box coronavirus apps it's hard to tell 
Real,1290899095306067968,bmw plunges to second-quarter ebit loss as coronavirus pandemic hits car sales 
Real,1290897873475969024,"germany's confirmed coronavirus cases rise by 741 to 212,022: rki "
Real,1290895375327539200,what you need to know about the coronavirus right now 
Real,1290891613108150274,"mexico reports 6,148 coronavirus cases and 857 more deaths "
Real,1290885283886637056,"global coronavirus deaths exceed 700,000, one person dies every 15 seconds on average "
Real,1290880618746785794,india's police shamed by rare murder probe into custodial deaths of father and son locked up for violating a nationwide coronavirus lockdown 
Real,1290875961047580672,"coronavirus update:
🇦🇺australia fears contagion as victoria state reports record deaths "
Real,1290872766028161024,china reports 27 new coronavirus cases in mainland for aug. 4 
Real,1290870189161054208,coronavirus complicates south korea flood response as hundreds gather in shelters 
Real,1290868918320541697,japan short of rescue plans for regional lenders hit by pandemic 
Real,1290863996636213254,u.s. losses from coronavirus-related fraud and identity theft near $100 million as covid scams double 
Real,1290857623642935296,latin america now has world's highest coronavirus death toll 
Real,1290856357395156992,disney takes $5 billion hit but pandemic impact not as bad as feared 
Real,1290855132649881603,oil prices toppled from rising streak as jump in covid-19 cases stokes fuel demand fears 
Real,1290848811909349376,"beyond meat racks up high covid-19 operational costs, shares fall 7% "
Real,1290845019692306437,u.s. coronavirus fraud losses near $100 million as covid scams double 
Real,1290839662764982272,india's police shamed by rare murder probe into custodial deaths of father and son locked up for violating a nationwide coronavirus lockdown 
Real,1290837471111057408,pandemic woes keep japan's service sector in decline at start of third quarter: pmi 
Real,1290831137418379266,"biotechnology company novavax said its vaccine candidate produced higher levels of antibodies in healthy volunteers after two doses than those found in recovered covid-19 patients, raising hopes for its eventual success "
Real,1290824889587437568,"novavax coronavirus vaccine induces immune response in early study, shares jump "
Real,1290817295871164416,teachers from dozens of school districts across the u.s. are protesting plans by some governors to resume in-class instruction while coronavirus cases are surging in many parts of the country 
Real,1290814877288861696,japan short of rescue plans for regional lenders hit by pandemic 
Real,1290809820161900545,disney takes $5 billion hit but pandemic impact not as bad as feared 
Real,1290802247006396419,"beyond meat racks up high covid-19 operational costs, shares fall 7% "
Real,1290800949741654019,"state attorneys general urge u.s. to increase supply, lower price of gilead covid-19 drug "
Real,1290797194904326144,ireland delays full reopening of bars again after covid-19 rate doubles 
Real,1290785858791124992,match forecasts sales above estimates as pandemic boosts tinder's appeal 
Real,1290778301343117317,proportion of youth with covid-19 triples in five months: who 
Real,1290775772223827970,"maryland-based biotechnology company novavax said its experimental covid-19 vaccine produced antibodies against the novel coronavirus and appears to be safe, according to an early stage study "
Real,1290774514012508161,"teachers from dozens of school districts nationwide are protesting plans by some governors to resume in-class instruction during the coronavirus pandemic, saying it threatens the safety of students, their families and educators "
Real,1290763203283165186,disney quarterly results fall short of pandemic disaster feared by investors 
Real,1290760763129450497,"brazil, hotbed for covid-19 vaccine testing, may struggle to produce its own "
Real,1290758026803249156,disney quarterly results fell short of the unmitigated pandemic disaster some investors feared as the company eked out an adjusted profit 
Real,1290753167135735808,"state attorneys general urge u.s. to increase supply, lower price of gilead covid-19 drug "
Real,1290745624254730242,special report: local governments 'overwhelmed' in race to trace u.s. covid contacts 
Real,1290740605388238849,aig's pandemic losses hit $730 million for first half of 2020: ceo 
Real,1290733041439178756,ireland delays full reopening of bars again after covid-19 rate doubles 
Real,1290731811224662016,indonesia eyes production of 250 million doses a year of coronavirus vaccine 
Real,1290729215524913156,stacey abrams said president trump and his fellow republicans have refused to acknowledge the deep threat posed by the covid-19 
Real,1290726796971974662,proportion of youth with covid-19 triples in five months: who 
Real,1290725440974249989,ralph lauren is getting slammed by a double whammy stemming from the pandemic - store closures and a slowdown in global demand for luxury goods $rl 
Real,1290711856227721217,tomorrow: what questions do you have about coronavirus treatments and vaccines? virologist @angie_rasmussen will answer them during our @reddit ama 
Real,1290711731044573186,"brazil, hotbed for covid-19 vaccine testing, may struggle to produce its own "
Real,1290706103769223168,"24-hour coronavirus update: 
🇺🇸 local governments ‘overwhelmed’ by contact tracing 
🇬🇧 britain prepares for a second wave this winter 
🇫🇷 second covid wave highly likely to hit france this year
"
Real,1290699142025621504,"black-owned businesses more vulnerable to coronavirus crisis, ny fed says "
Real,1290696768083169280,special report: local governments 'overwhelmed' in race to trace u.s. covid contacts 
Real,1290695242111307776,"ralph lauren corp said on tuesday its quarterly revenue plunged by nearly $1 billion, as it struggled with coronavirus-led store closures and a slowdown in demand for luxury goods across the world $rl "
Real,1290692775533514755,"second covid wave highly likely to hit france this year, scientists say "
Real,1290691466826846226,the u.s. military is helping worn-out nurses and sicker in hospitals struggling to deal with the covid-19 outbreak 
Real,1290690241045704706,aig's pandemic losses hit $730 million for first half of 2020: ceo 
Real,1290686692828078082,"uk risks big second coronavirus wave if it reopens schools without more testing, study finds "
Real,1290684187792609280,"the pandemic means fewer clients with less money for stylist julia wanja, so she is cutting down on costs by cleaning and reselling hair from a nairobi dumpsite "
Real,1290683917029310465,voting rights advocate stacey abrams said the united states has fumbled its response to the coronavirus outbreak through ‘willful ignorance’ 
Real,1290682939626467331,florida governor ron desantis holds a covid-19 roundtable. watch here  👉
Real,1290682707538841620,top senate democrat says covid-19 relief talks 'moving in the right direction' 
Real,1290679475668230144,"special report: with over 4.6 million confirmed infections and more than 155,000 deaths in the u.s., public health measures during the pandemic have been largely decentralized and lag other wealthy countries "
Real,1290663607055908867,.@who officials at the pan american health organization give an update on the covid-19 fight in the americas 
Real,1290662546840707074,who says china team interviewed wuhan scientists over virus origins 
Real,1290657532319498244,stacey abrams says u.s. is fumbling coronavirus response through 'willful ignorance' 
Real,1290657264311861248,"special report: many local health departments told @reuters they were overwhelmed in their efforts to trace covid-19 contacts. several researchers have described u.s. contact tracing overall as too little, too late "
Real,1290656293246644224,ralph lauren revenue sinks as pandemic hammers demand 
Real,1290654976402952193,"the pentagon has sent staff to parts of california and texas, where hospitals are struggling to find enough personnel to meet a wave of coronavirus cases "
Real,1290651223956365315,president donald trump vowed he would sue nevada after the state’s democratic lawmakers passed a bill to send mail-in ballots to every voter ahead of november’s presidential election in light of the coronavirus pandemic 
Real,1290648878950359048,venezuela produce market is at center of caracas covid-19 outbreak 
Real,1290645190366187520,"the u.s. economy, battered by a resurgence in the spread of covid-19, needs increased government spending to tide over households and businesses and broader use of masks to better control the virus, u.s. central bankers said "
Real,1290639897703976961,"most of us have accepted covid-19 face masks as an inconvenient, albeit necessary, safety measure. for the style conscious like james maina mwangi, however, they are an unmissable fashion opportunity "
Real,1290639883971723265,"second covid wave 'highly likely' to hit france this year, scientists say "
Real,1290638638255046657,poland reports record increase in covid cases as coal mines hit 
Real,1290636125774675968,spirit posts bigger-than-exepcted loss as virus hits aero parts demand 
Real,1290633762410299394,vietnam capital low on kits for mass tests as nation's virus cases climb 
Real,1290626700372574208,"many city and county departments in the u.s. say they lack the money and staff to expeditiously identify people who have been exposed to the coronavirus, according to a @reuters survey "
Real,1290623554715877379,special report: local governments 'overwhelmed' in race to trace u.s. covid contacts 
Real,1290622777238720512,"top congressional democrats and white house negotiators said they had made progress in talks on a new coronavirus relief bill, though the administration said president donald trump could act alone if no deal is reached "
Real,1290616751709990914,hair scavenged from nairobi dump ends up in salon amid covid-19 pandemic 
Real,1290614774062088198,who says china team interviewed wuhan scientists over virus origins 
Real,1290613487329320965,"recorded lessons form part of an initiative by an indian non-profit spread over six villages that aims to reach 1,000 students denied formal classes since the coronavirus pandemic forced schools to close four months ago "
Real,1290612243210670080,"military helps worn-out nurses, sicker patients in california covid-19 effort "
Real,1290611855875088384,australia has closed the national park home to its revered indigenous site of uluru after some in the community blocked an access route for fear that visitors could carry in coronavirus infections 
Real,1290608427698356225,hair scavenged from nairobi dump ends up in salon amid covid-19 pandemic 
Real,1290606439443161093,"teachers at dozens of school districts protested from their cars over plans by some u.s. governors to resume in-class instruction during the coronavirus pandemic, while arizona, florida, california and texas saw declines in new cases "
Real,1290604653621719043,aviation sector has biggest pandemic default risk: insurance survey 
Real,1290600878647529473,"philippines reports 6,352 coronavirus cases, southeast asia's biggest daily jump "
Real,1290598111887400961,indigenous australian group blocks uluru access route over pandemic fears 
Real,1290594591717101573,"britain faces a second wave of covid-19 this winter twice as widespread as the initial outbreak if it reopens schools without a more effective test-and-trace system in place, according to a recent study "
Real,1290593410227765248,"second covid wave 'highly likely' to hit france this year, scientists say "
Real,1290592290554228738,bp cut its dividend for the first time in a decade after reporting a record 5.12 billion pounds loss in the second quarter as the coronavirus crisis hammered energy demand 
Real,1290581262374141958,u.n. secretary-general antonio guterres warns world facing 'generational catastrophe' on education because of school closures amid the coronavirus pandemic 
Real,1290580923948453888,taiwan provisionally approves dexamethasone as coronavirus treatment 
Real,1290575838719680512,"uk risks twice-as-big second covid wave without better testing, study finds "
Real,1290574573000437760,oil prices fall as rising coronavirus case numbers cast shadow over fuel demand pickup 
Real,1290564149114802177,this indian non-profit is using loudspeakers to teach students denied formal classes after the coronavirus pandemic forced schools to close four months ago 
Real,1290558152774221824,aviation sector has biggest pandemic default risk: insurance survey 
Real,1290554843623337984,"coronavirus update: 
🇦🇺 australian state to deploy military, impose hefty fines to enforce isolation "
Real,1290554520100114433,germany already dealing with second coronavirus wave: doctors' union 
Real,1290552782899097606,indigenous australian group blocks uluru access route over pandemic fears 
Real,1290551917731557382,this restaurant in spain is pioneering a dining experience that allows customers to avoid most face-to-face contact with staff and minimize the risk of coronavirus contagion 
Real,1290527882251558912,australian state to deploy military and impose hefty fines to enforce covid-19 isolation orders 
Real,1290526638246105091,oil prices fall as rising coronavirus case numbers cast shadow over fuel demand pickup 
Real,1290522623470907392,"latin america breaks through 5 million confirmed cases of covid-19, @reuters tally shows "
Real,1290516574714167297,chief of staff to brazil's bolsonaro tests positive for covid-19 
Real,1290512554356289536,.@reuters followed volunteers from this indian non-profit as they carried a loudspeaker through villages in the state of maharashtra to teach students denied formal classes after the coronavirus pandemic forced schools to close four months ago 
Real,1290506504957841408,"u.s. teachers protest school reopenings, coronavirus cases down in south, west "
Real,1290505951209021445,u.n. secretary-general antonio guterres warns world facing 'generational catastrophe' on education because of school closures amid the coronavirus pandemic 
Real,1290505249405444097,"germany's confirmed coronavirus cases rise by 879 to 211,281: rki "
Real,1290496464565673986,china reports 36 new coronavirus cases in mainland vs 43 a day earlier 
Real,1290495315989032960,"coronavirus update: 
🇦🇺 australian state to deploy military, impose hefty fines to enforce isolation "
Real,1290492867043983363,australian state to deploy military and impose hefty fines to enforce covid-19 isolation orders 
Real,1290491437637754881,"mexico reports 4,767 new coronavirus cases, 266 more deaths "
Real,1290490230294757379,"brazil reports 16,641 new coronavirus cases, 561 new deaths "
Real,1290481663252631552,'speaker brother': loudspeakers teach indian children after virus shutters schools 
Real,1290480159695372288,oil prices drop on fuel demand worries as coronavirus flares up 
Real,1290477369183019009,"latin america breaks through 5 million confirmed cases of covid-19, @reuters tally shows "
Real,1290476315594768387,"australian state to deploy military, impose hefty fines to enforce virus isolation "
Real,1290471277350858754,fauci says states seeing surge in covid-19 cases should reconsider some lockdown measures 
Real,1290467492331126784,"president trump lashed out at coronavirus task force coordinator dr. deborah birx, calling her ‘pathetic’ after her sobering assessment of the coronavirus outbreak in the u.s. "
Real,1290463724449431557,"california governor says covid-19 cases, hospitalizations, trending down "
Real,1290459950326652929,regeneron says antibody cocktail prevents and treats covid-19 in animals 
Real,1290458692727582723,tyson foods names new ceo as coronavirus raises costs 
Real,1290457448613064704,"u.s. teachers protest school reopenings, coronavirus cases down in south, west "
Real,1290455004155973633,chief of staff to brazil's bolsonaro tests positive for covid-19 
Real,1290452474139152385,"pelosi says coronavirus aid talks with mnuchin, meadows to continue tuesday "
Real,1290449874878697478,"north carolina officials urged residents to not let covid-19 concerns prevent emergency evacuation as tropical storm isaias, moving toward the carolinas, is expected to regain hurricane strength "
Real,1290448729531650048,new jersey governor retightens restrictions on indoor gatherings after covid-19 surge 
Real,1290447468770004994,"latin america exceeds 5 million covid-19 cases, reuters tally shows "
Real,1290442452789350401,"france reports 3,376 new covid-19 cases over three-day period "
Real,1290436209374896128,engineered decoys trap virus in test tube study; healthcare workers at high risk even with protections 
Real,1290431012175060998,uk reports second-highest covid-19 cases since june 
Real,1290426005539164160,italy survey suggests coronavirus six times more prevalent than official data 
Real,1290423490106056706,fauci says states seeing surge in covid-19 cases should reconsider some lockdown measures 
Real,1290417284608122880,"california governor says covid-19 cases, hospitalizations, trending down "
Real,1290414658709606402,south african corruption watchdog probes covid-19 tenders 
Real,1290410880988000256,"u.s. covid-19 deaths rise for fourth week, new cases drop 5% "
Real,1290409687549083649,tyson foods names new ceo as coronavirus raises costs 
Real,1290407097314603008,president trump took a public swipe at white house coronavirus task force coordinator dr. deborah birx a day after she said infections from the virus were ‘extraordinarily widespread’ in the u.s. 
Real,1290402071926247431,new jersey governor retightens restrictions on indoor gatherings after covid-19 surge 
Real,1290399932025839616,spain to roll out covid-19 app twice as effective as human tracers in pilot 
Real,1290398358692147203,florida to provide 15-minute covid-19 test results at two sites 
Real,1290392048860893184,anxious who implores world to 'do it all' in long war on covid-19 
Real,1290390782986407936,u.s. auto sales pandemic recovery continues as toyota decline slows 
Real,1290389611072626688,engineered decoys trap virus in test tube study; healthcare workers at high risk even with protections 
Real,1290388273848823810,"pelosi says coronavirus aid talks with mnuchin, meadows to continue tuesday "
Real,1290386989553000453,eli lilly tests antibody drug to halt covid-19 spread in u.s. nursing homes 
Real,1290384462363136004,uk reports second-highest covid-19 cases since june 
Real,1290380756871766016,new york's cuomo calls federal covid-19 response 'worst government blunder in modern history' 
Real,1290379558089351170,italy survey suggests coronavirus six times more prevalent than official data 
Real,1290373175554048002,fauci says states seeing surge in covid-19 cases should reconsider some lockdown measures 
Real,1290371178713030656,"california governor newsom said covid-19 cases, hospitalizations and intensive care unit admissions in the state were all trending down "
Real,1290366827676053505,".@who director general tedros adhanom ghebreyesus said there are concerns that covid-19 vaccines might not prove effective, or that they might convey protections for just a few months "
Real,1290362688850161664,california governor@gavinnewsom discusses the state's covid-19 response as cases soar 
Real,1290359793375485952,ask virologist @angie_rasmussen anything about treating and preventing covid-19 during our @reddit ama on wednesday at 11 a.m. et. get your questions ready! 
Real,1290359615687884801,"spain reports 968 new coronavirus cases, total exceeds 288,000 "
Real,1290355508503818241,covid-19 long-term toll signals billions in healthcare costs ahead 
Real,1290354432358703105,new jersey governor retightens restrictions on indoor gatherings after covid-19 surge 
Real,1290350491860381698,next big covid-19 treatment may be manufactured antibodies 
Real,1290344208935587845,florida to provide 15-minute covid-19 test results at two sites 
Real,1290343051634839553,"mexico's factories still hurting from coronavirus, some signs for optimism "
Real,1290341787719131137,u.s. auto sales pandemic recovery continues as toyota decline slows 
Real,1290340454769328128,eli lilly starts late-stage study of covid-19 drug in nursing homes 
Real,1290339508026826757,"thread: we reported for @reuters on how gov’ts/insurers plan to deal w/ #covid19 long-haulers. 

like the post-9/11 or hiv era, such victims are becoming their own class of care. 

here are some distressing anecdotes that didn’t make the story. /1 

"
Real,1290337887087722498,"the world health organization warned that there might never be a 'silver bullet' for covid-19 in the form of a perfect vaccine and that the road to normality would be long, with some countries requiring a reset of strategy "
Real,1290336805594726401,spain to roll out covid-19 app twice as effective as human tracers in pilot 
Real,1290334878353911811,.@nygovcuomo makes an announcement during a covid-19 update 
Real,1290332985888133121,.@nygovcuomo makes an announcement during a covid-19 update 
Real,1290325342213767169,norway suspends cruise ship arrivals with 100+ people on board after virus outbreak 
Real,1290318666442080256,florida governor ron desantis gives a covid-19 update. watch live here 👉 
Real,1290315271002034176,pandemic revs up race for u.s. online car sales 
Real,1290311476243243016,insurers face possible british action over calculation of pandemic payouts 
Real,1290308178706608130,"catch up with the latest pandemic-related financial insights from @breakingviews, from alcohol-free beer to a resurgence of infections in asia, in the latest edition of corona capital "
Real,1290307774929178624,covid-19 long-term toll signals billions in healthcare costs ahead 
Real,1290305265426771970,anxious who implores world to 'do it all' in long war on covid-19 
Real,1290305195168145408,"24-hour coronavirus update: 
🇮🇳 top indian ministers in hospital as cases breach 50,000 for fifth day
🇸🇬 singapore to make travelers wear electronic tags to enforce quarantine
🌎 there may never be a 'silver bullet' for covid-19, who warns
"
Real,1290302719857692673,next big covid-19 treatment may be manufactured antibodies 
Real,1290299036184875008,joint u.s. military drills get thumbs down from thais amid virus fears 
